{
  "reportVersion": 1,
  "validatorVersion": "unversioned",
  "registry": {
    "engine": "JManhunt",
    "engineVersion": "rev-10e2b55"
  },
  "files": [
    {
      "file": "jmhmods/cursed-aqua.yml",
      "diagnostics": [
        {
          "behavior": "main",
          "list": "player",
          "line": 3,
          "char": 55,
          "severity": "warning",
          "code": "W_UNKNOWN_TAG",
          "message": "Unknown tag '<phaseffect:?,water_breathing>', left untouched at runtime."
        },
        {
          "behavior": "",
          "list": "info_message",
          "line": 0,
          "char": null,
          "severity": "warning",
          "code": "W_SETTINGS_STRAY_LEAF",
          "message": "flat settings root holds bare leaf 'info_message' with zero folders; group leafs into folders"
        },
        {
          "behavior": "",
          "list": "info_sound",
          "line": 0,
          "char": null,
          "severity": "warning",
          "code": "W_SETTINGS_STRAY_LEAF",
          "message": "flat settings root holds bare leaf 'info_sound' with zero folders; group leafs into folders"
        },
        {
          "behavior": "",
          "list": "effect_list",
          "line": 0,
          "char": null,
          "severity": "warning",
          "code": "W_SETTINGS_STRAY_LEAF",
          "message": "flat settings root holds bare leaf 'effect_list' with zero folders; group leafs into folders"
        },
        {
          "behavior": "",
          "list": "neutralize_water_breathing",
          "line": 0,
          "char": null,
          "severity": "warning",
          "code": "W_SETTINGS_STRAY_LEAF",
          "message": "flat settings root holds bare leaf 'neutralize_water_breathing' with zero folders; group leafs into folders"
        },
        {
          "behavior": "",
          "list": "warn_message",
          "line": 0,
          "char": null,
          "severity": "warning",
          "code": "W_SETTINGS_STRAY_LEAF",
          "message": "flat settings root holds bare leaf 'warn_message' with zero folders; group leafs into folders"
        },
        {
          "behavior": "",
          "list": "warn_sound",
          "line": 0,
          "char": null,
          "severity": "warning",
          "code": "W_SETTINGS_STRAY_LEAF",
          "message": "flat settings root holds bare leaf 'warn_sound' with zero folders; group leafs into folders"
        }
      ]
    }
  ],
  "summary": {
    "files": 1,
    "errors": 0,
    "warnings": 7
  }
}
