{
  "reportVersion": 1,
  "validatorVersion": "unversioned",
  "registry": {
    "engine": "JManhunt",
    "engineVersion": "rev-10e2b55"
  },
  "files": [
    {
      "file": "shipped/random-mob-spawner.yml",
      "diagnostics": [
        {
          "behavior": "",
          "list": "meta",
          "line": 0,
          "char": null,
          "severity": "warning",
          "code": "W_UNKNOWN_KEY",
          "message": "Unknown key 'icon' in meta; ignoring it."
        }
      ]
    }
  ],
  "summary": {
    "files": 1,
    "errors": 0,
    "warnings": 1
  }
}
