{
  "reportVersion": 1,
  "validatorVersion": "unversioned",
  "registry": {
    "engine": "JManhunt",
    "engineVersion": "rev-10e2b55"
  },
  "files": [
    {
      "file": "jmhmods/bounty.yml",
      "diagnostics": [
        {
          "behavior": "pay-kill",
          "list": "console",
          "line": 37,
          "char": null,
          "severity": "error",
          "code": "E_SYNTAX",
          "message": "Tag <if> mixes quotes."
        },
        {
          "behavior": "",
          "list": "<root>",
          "line": 0,
          "char": null,
          "severity": "warning",
          "code": "W_SETTINGS_FOLDERS",
          "message": "10 folders (max 5): targeting, rules, team_groceries, team_effects, team_stats, killer_groceries, killer_effects, killer_stats, sounds, messages"
        },
        {
          "behavior": "",
          "list": "sounds",
          "line": 0,
          "char": null,
          "severity": "warning",
          "code": "W_SETTINGS_LEAFS",
          "message": "8 leafs (max 7): team_kill, killer_kill, friendly, expire, warn, offer, assigned, slain"
        }
      ]
    }
  ],
  "summary": {
    "files": 1,
    "errors": 1,
    "warnings": 2
  }
}
