{
  "reportVersion": 1,
  "validatorVersion": "unversioned",
  "registry": {
    "engine": "JManhunt",
    "engineVersion": "rev-10e2b55"
  },
  "files": [
    {
      "file": "shipped/speedrunner-gapple-on-low-hp.yml",
      "diagnostics": []
    }
  ],
  "summary": {
    "files": 1,
    "errors": 0,
    "warnings": 0
  }
}
