{
  "reportVersion": 1,
  "validatorVersion": "unversioned",
  "registry": {
    "engine": "JManhunt",
    "engineVersion": "dev"
  },
  "files": [
    {
      "file": "jmhmods/scary-sounds.yml",
      "diagnostics": []
    }
  ],
  "summary": {
    "files": 1,
    "errors": 0,
    "warnings": 0
  }
}
